"COMMENT_ID","AUTHOR","DATE","CONTENT","VIDEO_NAME","CLASS"
1015,"Susan Ambs",NA,"Check out this video on YouTube:﻿","Eminem - Love The Way You Lie ft. Rihanna",1
1016,"John Monster",2014-11-03 14:08:14,"Οh my god ... Roar is the most liked video at Vevo .. while 2 months ago  was Justin's Baby.. congrats Katy . Applause &lt;3 ﻿","Katy Perry - Roar",0
1017,"Peter Johnson",2014-11-06 01:44:12,"Get free gift cards and pay pal money!﻿","PSY - GANGNAM STYLE(?????) M/V",1
1018,"Jdidk Loma",2014-01-20 20:35:56,"http://tankionline.com#friend=cd92db3f4 great game check it out!﻿","PSY - GANGNAM STYLE(?????) M/V",1
1019,"Daniel Harding",2015-05-07 22:59:13.323,"That guy charley of lost TV show﻿","Eminem - Love The Way You Lie ft. Rihanna",0
1020,"joory amora",2015-05-09 00:07:53.422,"Pleas subscribe GamezZ MTA my channel<br />﻿","Shakira - Waka Waka",1
1021,"Salty Croc",2014-07-22 04:20:37.489,"Like this comment for no reason﻿","LMFAO - Party Rock Anthem ft. Lauren Bennett, GoonRock",1
1022,"Playboy 808",2015-05-28 17:25:06.652,"Fuck Eminem. Bieber is the best &lt;3﻿","Eminem - Love The Way You Lie ft. Rihanna",0
1023,"Salim Tayara",2014-11-02 14:33:30,"if your like drones, plz subscribe to Kamal Tayara. He takes videos with  his drone that are absolutely beautiful.﻿","PSY - GANGNAM STYLE(?????) M/V",1
1024,"Brandon Thaler",NA,"Hey everyone check out my channel leave a like and subscribe please and if there is a song you want me to do post the name in the comments and I will get on to it(: Thanks","Eminem - Love The Way You Lie ft. Rihanna",1
1025,"Kishore sl",2015-05-28 18:41:47.26,"Don&#39;t love someone soo much, love the way u lie..﻿","Eminem - Love The Way You Lie ft. Rihanna",0
1026,"Carlos Rueda",2015-05-22 15:04:20.31,"I am going to blow my mind﻿","LMFAO - Party Rock Anthem ft. Lauren Bennett, GoonRock",0
1027,"itzquiffer",2014-11-08 03:47:23,"C'mon 3 billion views!!!!!!!!﻿","PSY - GANGNAM STYLE(?????) M/V",0
1028,"Paul Crowder",2015-05-27 00:33:53.183,"This Will Always Be My Favorite Song<br />But My Favorite Part Is <a href=""http://www.youtube.com/watch?v=KQ6zr6kCPj8&amp;t=3m40s"">3:40</a>-<a href=""http://www.youtube.com/watch?v=KQ6zr6kCPj8&amp;t=4m11s"">4:11</a> In The Video ﻿","LMFAO - Party Rock Anthem ft. Lauren Bennett, GoonRock",0
1029,"NerdyQueen〈3",2015-04-28 01:07:30.541,"Check out this playlist on YouTube:﻿","LMFAO - Party Rock Anthem ft. Lauren Bennett, GoonRock",1
1030,"Lotoya Bolan",2015-02-20 01:53:33.412,"Check out this playlist on YouTube:﻿","LMFAO - Party Rock Anthem ft. Lauren Bennett, GoonRock",1
1031,"bossdon redhouse",2015-05-25 15:53:41.74,"I really am madly in love with this woman!!﻿","Shakira - Waka Waka",0
1032,"Melissa Erhart",NA,"Check out this playlist on YouTube:chcfcvzfzfbvzdr﻿","Eminem - Love The Way You Lie ft. Rihanna",1
1033,"Tiza Arellano",2015-05-29 00:14:48.748,"I love song ﻿","Shakira - Waka Waka",0
1034,"Young IncoVEVO",2014-11-12 07:14:06,"Check out my Music Videos! Fuego - U LA LA Remix  hyperurl.co/k6a5xt﻿","PSY - GANGNAM STYLE(?????) M/V",1
1035,"jemy Abdulrahman",2013-09-05 19:30:37.124,"WOw","Shakira - Waka Waka",0
1036,"Salah DK",2014-07-22 13:45:20.355,"awesome﻿","LMFAO - Party Rock Anthem ft. Lauren Bennett, GoonRock",0
1037,"Vincenzo Canino 98",2014-09-28 12:38:26,"Fantastic!!!﻿","Katy Perry - Roar",0
1038,"Sid",2015-02-21 06:19:03.549,"At 500 subscribers i&#39;m sky diving help me reach my goal &lt;3<br />Trust me, i&#39;m a doctor.  :)﻿","LMFAO - Party Rock Anthem ft. Lauren Bennett, GoonRock",1
1039,"tori strong",2015-05-25 01:56:04.076,"love the way you lie featuring rhianna, hes an awesome rapper!!! shes an awesome singer!!!﻿","Eminem - Love The Way You Lie ft. Rihanna",0
1040,"Nick McGoldrick",2014-10-27 13:19:06,"Check out my drum cover of E.T. here! thanks -&gt;   /watch?v=NO9pOVZ9OIQ&amp;list=UUltuCDIHsDeI01by1OW7WuQ﻿","Katy Perry - Roar",1
1041,"Gloria Garcia",2014-11-04 11:38:51,"subscribe to itz recaps and above diddle﻿","PSY - GANGNAM STYLE(?????) M/V",1
1042,"LegacyStarz OS",2014-12-07 06:40:55.233,"Check out this video on YouTube:﻿","LMFAO - Party Rock Anthem ft. Lauren Bennett, GoonRock",1
1043,"Emerson Zanol Zanol",2014-11-04 13:48:04,"need money?Enjoy https://www.tsu.co/emerson_zanol﻿","PSY - GANGNAM STYLE(?????) M/V",1
1044,"Miguel Del Valle",2014-08-26 02:44:42,"http://9gag.com/gag/aAVpwj9/ =)﻿","Katy Perry - Roar",1
1045,"Dakoda Bigelow",NA,"Hey everyone, I&#39;m Dakoda Bigelow.  I&#39;m a 17 year old singer, rapper and producer.  I&#39;ve gained over 490,000 views so far but I really need more views, likes and subscribers in order to make it.  Check out my brand new music video for my song So Gone!  Also check out my new song called Deaf.  A few moments of your time would be greatly appreciated and you won&#39;t regret it :)  Please thumbs this up so more people can see it!  Thanks for the support.","Eminem - Love The Way You Lie ft. Rihanna",1
1046,"Jacky Chan",2014-11-08 14:17:38,"For latest movies 2014 please visit this site  http://www.networkedblogs.com/p/11cPWb?ref=panorama﻿","Katy Perry - Roar",1
1047,"Terry Short",2015-05-26 14:33:52.496,"Support the fight for your 4th amendment right to privacy in your home.  Stop the NSA spying on Americans with the un Patriot Act Renewal. Rand Paul has spent 10.5 hours on the Senate floor in a Protest and Filibuster fighting for our  Constitution that this Nation is founded on. Join the fight at Rand Paul dot com. Spread The Word. We Have Someone That Cares About Our Nation.  Email your Senators, Congress men and women, tell them to support Rand. Tell the news to support Rand too Senator Rand Paul was up until <a href=""http://www.youtube.com/watch?v=pRpeEdMmmQ0&amp;t=1m00s"">1:00</a> am this passed Saturday morning fighting for our Constitution buy postponing the vote until this week. Our Constitution Matters join Rand in the fight to protect <a href=""http://it.ht"">it.ht</a> to privacy in your home and business.. Senator Rand Paul was up until <a href=""http://www.youtube.com/watch?v=pRpeEdMmmQ0&amp;t=1m00s"">1:00</a> am this passed Saturday  morning fighting for our Constitution buy postponing the vote until this week. Our Constitution Matters To All Of US, Help Rand Protect It by joining the fright for it.﻿","Shakira - Waka Waka",1
1048,"louis canellony",NA,"watch youtube video &quot;EMINEM -YTMA artist of the year&quot; plz share to vote!!!","Eminem - Love The Way You Lie ft. Rihanna",1
1049,"Neo Joey",2014-09-10 09:09:57,"Katy perry is and inspirational singer her voice is awesome and I loved her  so much . She achieved music history and I couldn't believe that . Guys if  you could take 1min to go to my channel and watch my first video I would be  greatly thankful for this :) ty guys N katy is still awesome xoxo﻿","Katy Perry - Roar",1
1050,"Justin Chery",2014-09-01 17:55:34,"And after the video ends, a 13 ft. boa constrictor squeezes her to death.﻿","Katy Perry - Roar",0
1051,"Tyrek Sings",2014-11-05 22:50:02,"CHECK MY CHANNEL OUT PLEASE. I DO SINGING COVERS﻿","PSY - GANGNAM STYLE(?????) M/V",1
1052,"ItsJoey Dash",2014-07-22 10:02:25.925,"EVERYONE PLEASE GO SUBSCRIBE TO MY CHANNEL OR JUST LOON AT MY VIDEOS﻿","LMFAO - Party Rock Anthem ft. Lauren Bennett, GoonRock",1
1053,"JD COKE",2014-11-08 02:24:02,"It's so hard, sad :( iThat little child Actor HWANG MINOO dancing very  active child is suffering from brain tumor, only 6 month left for him .Hard  to believe .. Keep praying everyone for our future superstar.  #StrongLittlePsY #Fighting  SHARE EVERYONE PRAYING FOR HIM http://ygunited.com/2014/11/08/little-psy-from-the-has-brain-tumor-6-months-left-to-live/ ﻿","PSY - GANGNAM STYLE(?????) M/V",1
1054,"Insomniac",2015-05-19 23:17:19.12,"Man this song really does get in your bones - one minute I&#39;m nearly dosing off to sleep - the next I&#39;m shuffling like crazy with hot feet XD﻿","LMFAO - Party Rock Anthem ft. Lauren Bennett, GoonRock",0
1055,"All Or Nothing AMV",2014-09-16 11:02:58.43,"Subscribe﻿","LMFAO - Party Rock Anthem ft. Lauren Bennett, GoonRock",1
1056,"Bert Ernie",2014-11-08 00:45:40,"this jap is such a piece of shit. he is such a worthless fish head. i dont  know how any one likes this dumb untanlted gook. this isnt even fucken  music. this is so fucking sad that this is even such thing. people are so  fucked up.﻿","PSY - GANGNAM STYLE(?????) M/V",0
1057,"Henri Kameron",2015-05-27 15:44:45.019,"just :( superr!!!﻿","LMFAO - Party Rock Anthem ft. Lauren Bennett, GoonRock",0
1058,"Pettrus Ortega",2014-09-18 11:35:49,"THIS IS A COMPETITION TO MEET MY IDOLS, IT WOULD MEAN SO MUCH IF YOU GUYS  WILL LIKE THIS PIC ON IG! http://instagram.com/p/smZdivopxb/﻿","Katy Perry - Roar",1
1059,"stupittmoran",2015-01-04 15:42:24.811,"Check out this video on YouTube:﻿","LMFAO - Party Rock Anthem ft. Lauren Bennett, GoonRock",1
1060,"JS Scott",2015-03-08 21:27:05.377,"subscribe to <span class=""proflinkWrapper""><span class=""proflinkPrefix"">+</span><a class=""proflink"" href=""https://plus.google.com/104999962146104962510"" oid=""104999962146104962510"">SuperMarioLogan</a></span>  if you thot the robot dudes r epic and awsome﻿","LMFAO - Party Rock Anthem ft. Lauren Bennett, GoonRock",1
1061,"TheHariiiii",2014-11-02 16:17:11,"-----&gt;&gt;&gt;&gt;  https://www.facebook.com/video.php?v=10200253113705769&amp;set=vb.201470069872822&amp;type=3&amp;permPage=1  &lt;--------﻿","PSY - GANGNAM STYLE(?????) M/V",1
1062,"Chelsea Cameron",NA,"*****PLEASE READ*****  Hey everyone! I&#39;m a 19 year old student  who loves to sing.  I record and upload covers on my channel. I would love if you could check them out.  Just give me a chance. You don&#39;t have to thumbs up or subscribe (But you can if you like what your hear)  Just listen. I&#39;d really appreciate.  ~THANK YOU for your time. ~","Eminem - Love The Way You Lie ft. Rihanna",1
1063,"Karen Cervantes",2015-05-24 00:15:08.291,"Love Song﻿","Eminem - Love The Way You Lie ft. Rihanna",0
1064,"Bernice Anne",2013-08-16 18:33:18.009,"Could you please check out my covers on my channel? I do covers like Adele, Kodaline, Imagine Dragons...and more. Please if you could spare a few minutes,  could you have a listen to one or two of my covers , Feel free to comment and subscribe :) Thank you!","Shakira - Waka Waka",1
1065,"Daniel Klous",2015-05-28 20:24:21.778,"OMG that looks just like a piece of the mirror of harry potter and the deathly hallows.<br />Either that house. (sirius black)﻿","Eminem - Love The Way You Lie ft. Rihanna",0
1066,"Roham 11",2015-05-22 20:42:29.523,"Strong messages in every  song I&#39;ve  heard.﻿","LMFAO - Party Rock Anthem ft. Lauren Bennett, GoonRock",0
1067,"Danny Ly",2014-10-09 00:37:48,"FREe ITunes Gift card http://shhort.com/a?r=x6J4gBrne﻿","Katy Perry - Roar",1
1068,"Brittany Tennyson",2014-10-04 04:31:08.642,"Check out this video on YouTu﻿","LMFAO - Party Rock Anthem ft. Lauren Bennett, GoonRock",1
1069,"Ikram Riani",2015-05-20 18:53:35.943,"I lovet﻿","Eminem - Love The Way You Lie ft. Rihanna",0
1070,"Ando Nesia - | MC | Music Producer",NA,"DO YOU KNOW HOW SEAN KINGSTON GOT FAMOUS WHY DON&#39;T YOU LOOK IT UP KID BEFORE YOUR SO HARD ON YOURSELF!!  IF YOU HIT ME UP WITH A MESSAGE IN MY INBOX AND SUBSCRIBE I WILL CHECK OUT YOUR CHANNEL....SOUNDS FAIR TO ME.","Eminem - Love The Way You Lie ft. Rihanna",1
1071,"latrell brown",2013-10-08 18:26:06.234,"Check Out Daneja Good Girl","Shakira - Waka Waka",1
1072,"deazy99",NA,"I know that maybe no one will read this but PLEASE TYPE IN &quot;deazy99&quot; I&#39;m a rapper with a dream. I know you must see like millions of those on here everyday but please check out my music and subscribe if you&#39;d like thank you, i would love nothing more than to have a decent following on youtube from people if anyone reading this could give it a &quot;THUMBS UP&quot; because what some might see as just a simple button press could make my dream come true..thank you again for your time &amp; may god bless you","Eminem - Love The Way You Lie ft. Rihanna",1
1073,"Fire Ghost73",2015-05-19 22:01:54.036,"cooooooooooooolllllllllll﻿","LMFAO - Party Rock Anthem ft. Lauren Bennett, GoonRock",0
1074,"Smile day",2015-05-20 16:17:41.577,":)﻿","LMFAO - Party Rock Anthem ft. Lauren Bennett, GoonRock",0
1075,"Earline Craver",2015-05-19 22:35:44.69,"Me and my big sister like you﻿","Eminem - Love The Way You Lie ft. Rihanna",0
1076,"thebayareapimp",2015-05-26 12:04:50.454,"WELL THIS DUDES FADED THE FUCK OUT!﻿","LMFAO - Party Rock Anthem ft. Lauren Bennett, GoonRock",0
1077,"Wendy Artiles",2015-04-16 00:20:37.792,"Check out this video on YouTube:﻿","LMFAO - Party Rock Anthem ft. Lauren Bennett, GoonRock",1
1078,"Kirsty Brown",2014-01-20 16:41:27,"Plz subscribe to my channel and I will subscribe back xx﻿","PSY - GANGNAM STYLE(?????) M/V",1
1079,"Eminem King of Rap !",NA,"Eminem is the king of rap  Micheal Jackson is the king of pop  If you also wanna go hard and wanna be the person of first class fame just check out Authenticviews*com and be famous just within days !! yO ~","Eminem - Love The Way You Lie ft. Rihanna",1
1080,"Angela Alor",2015-05-20 19:53:57.924,"HOW DO YOU PUT A PICTURE FOR YOUR IMAGE THINGIE?!?!﻿","LMFAO - Party Rock Anthem ft. Lauren Bennett, GoonRock",1
1081,"MagpiedudeGaming",2014-11-10 15:58:40,"I hate videos like these with those poor animals.﻿","Katy Perry - Roar",0
1082,"Miix_MC",2015-05-21 14:01:01.48,"epic﻿","LMFAO - Party Rock Anthem ft. Lauren Bennett, GoonRock",0
1083,"BDOG1040",2013-07-25 05:45:57.646,"SUBSCRIBE MY CHANNEL","Shakira - Waka Waka",1
1084,"Aleesha Hoover",2015-05-22 14:44:13.619,"Love the video ﻿","Eminem - Love The Way You Lie ft. Rihanna",0
1085,"Super Cot",2014-11-08 09:39:28,"1 million dislikes!EPIC FAIL(ready for you fanboys)﻿","PSY - GANGNAM STYLE(?????) M/V",0
1086,"Mohammad Abdelhafez",2014-09-20 12:33:21,"Hey guys subscribe to my channel for no reason! Please!..﻿","Katy Perry - Roar",1
1087,"Ameenk Chanel",2014-11-14 11:50:02,"Free my apps get 1m crdits ! Just click on the link and download a app and  done!! · Link: https://m.freemyapps.com/share/url/5af506e1﻿","PSY - GANGNAM STYLE(?????) M/V",1
1088,"Alex Weight-Loss",NA,"Fruits and vegetables give you longer lasting energy for weight loss.  Check out youtube.com/user/36loseweight.","Eminem - Love The Way You Lie ft. Rihanna",1
1089,"Lil M",NA,"Lil m !!!!! Check hi out!!!!! Does live the way you lie and many more ! Check it out!!! And subscribe","Eminem - Love The Way You Lie ft. Rihanna",1
1090,"luisel Tutoriales Gameplays (luisel Tutoriales)",2015-05-23 18:56:07.484,"music yeah﻿","LMFAO - Party Rock Anthem ft. Lauren Bennett, GoonRock",0
1091,"Vena Veno",2014-09-17 22:22:44,"She loves Vena. trojmiasto.pl/Vena-Bus-Taxi-o59253.html﻿","Katy Perry - Roar",1
1092,"liliana ciancio",2015-05-21 14:52:58.65,"Wanderfol is love or miusic﻿","Shakira - Waka Waka",0
1093,"youngj",2014-10-29 11:28:58,"People who believe in Illuminati are stupid the same people believe that  911 was made by the American government﻿","Katy Perry - Roar",0
1094,"조윤기",2015-03-21 18:25:05.665,"like this comment if you&#39;re watching this video when big bang happened<br />i do﻿","LMFAO - Party Rock Anthem ft. Lauren Bennett, GoonRock",1
1095,"A Way With Words",NA,"Check out our cover of this song!","Eminem - Love The Way You Lie ft. Rihanna",1
1096,"latisha garcia",2015-03-09 00:33:08.463,"Check out this playlist on YouTube: I tried﻿","LMFAO - Party Rock Anthem ft. Lauren Bennett, GoonRock",1
1097,"Chewwy Moriarty",2014-10-21 20:53:49,"I love this song﻿","Katy Perry - Roar",0
1098,"Like👑A👑Boss (Chloe that pony lover)",2015-05-26 16:56:19.78,"I fuckin love this song!<br /><br /><br />After, I&#39;m sexy and I know it ﻿","LMFAO - Party Rock Anthem ft. Lauren Bennett, GoonRock",0
1099,"Ciasteczko ;*",2015-05-26 17:56:36.413,"LMFAO best songs ever!﻿","LMFAO - Party Rock Anthem ft. Lauren Bennett, GoonRock",0
1100,"Abdullah Fawzi",2015-05-25 06:25:22.319,"coby this USL and past :<br /><a href=""http://adf.ly"">http://adf.ly</a> /1HmVtX<br />delete space after y﻿","Shakira - Waka Waka",1
1101,"Sean Gormaly",2015-05-27 01:47:25.865,"Is that Charlie from lost?﻿","Eminem - Love The Way You Lie ft. Rihanna",0
1102,"Dávid Baranovič",2014-07-23 11:57:11.271,"every bady yust have a good time﻿","LMFAO - Party Rock Anthem ft. Lauren Bennett, GoonRock",0
1103,"Ed Diamond",2014-10-17 16:41:35,"Man she is hot in this one, male companions visit my profile to check out  the coolest sextoy ever made!﻿","Katy Perry - Roar",1
1104,"Janie Musgrove",NA,"Check out this video on YouTube:﻿","Eminem - Love The Way You Lie ft. Rihanna",1
1105,"Nicky G",2015-05-19 20:56:00.184,"is that megan fox?﻿","Eminem - Love The Way You Lie ft. Rihanna",0
1106,"M.E.S",NA,"hey guys i know its annoying getting spammed sorry bout that but please take a moment to check out my channel  IM A RAPPER with DECENT skills. i want to share my music with more people so take a listen   THUMBS UP SO MORE CAN SEE THIS","Eminem - Love The Way You Lie ft. Rihanna",1
1107,"hernan perez ovando",2014-10-20 20:35:13,";-)﻿","Katy Perry - Roar",0
1108,"Maria Maldonado",2015-03-26 19:09:38.242,"Check out this playlist on YouTube:a﻿","LMFAO - Party Rock Anthem ft. Lauren Bennett, GoonRock",1
1109,"josson 64",2014-11-07 15:58:57,"SUPER!!! !!!!!!!!!!!!!!!!!!!!!!!!!!!!!!!!!!!!!!!!﻿","PSY - GANGNAM STYLE(?????) M/V",0
1110,"Mardhy Hassan",2014-10-19 14:59:26,"why tiger succumbs to a beautiful girl ?.probably male tiger.....????   ha.ha.ha..﻿","Katy Perry - Roar",0
1111,"Pj Jessie",2015-03-22 01:04:09.486,"Omg can this be the first video on YouTube to hit 1 billion views like this comment of you agree.﻿","LMFAO - Party Rock Anthem ft. Lauren Bennett, GoonRock",1
1112,"اسيا الخواجة",2013-09-05 18:47:29,"Nice","Shakira - Waka Waka",0
1113,"roflcopter2110",2014-09-19 23:18:41,"http://thepiratebay.se/torrent/10626048/The.Expendables.3.2014.DVDScr.LEAKED.CLEAN.XviD.MP3-RARBG ﻿","Katy Perry - Roar",1
1114,"Laura Da Silva",2015-05-27 20:53:19.614,"❤❤❤❤❤❤❤﻿","Eminem - Love The Way You Lie ft. Rihanna",0
1115,"Joyce Jones",NA,"Check out this playlist on YouTube:﻿","Eminem - Love The Way You Lie ft. Rihanna",1
1116,"Puppy Lover5614",2014-11-11 22:48:11,"I hav absolutely no idea what he's saying. Is it even a language?﻿","PSY - GANGNAM STYLE(?????) M/V",0
1117,"CHINMAY JANGID",2015-05-18 14:50:38.07,"5th most viewed video.. i guess﻿","LMFAO - Party Rock Anthem ft. Lauren Bennett, GoonRock",0
1118,"Rufus Korovina",2015-05-26 08:41:13.177,"love﻿","Eminem - Love The Way You Lie ft. Rihanna",0
1119,"RapStarz Coleman",2013-08-27 21:12:40.752,"I Know Y&#39;all Can Check Out Amy Music Because Yall Got Me Go To Da Channel","Shakira - Waka Waka",1
1120,"Hamza Hamza",2015-03-15 14:03:27.801,"Check out this video on YouTube:﻿","LMFAO - Party Rock Anthem ft. Lauren Bennett, GoonRock",1
1121,"James Cook",2013-10-15 17:00:04.573,"Stop Wasting Up Your Time and  Get Paid To Mess Around On Facebook And Twitter!  GET PAID UPTO $25 to $35 AN HOUR... Only at 4NetJobs.com  Work from the Comfort of your Home... We are Currently Hiring People from all Over the World,  For a Wide Range of Social Media Jobs on Sites such as Facebook,Twitter and YouTube.  You don&#39;t Need any Prior Skills or Experience and You can Begin Work Immediately!  You Can Easily Make $4000 to $5000+ Monthly Income…Only at 4NetJobs.com","Shakira - Waka Waka",1
1122,"rolle54100",2014-11-05 10:43:27,"how can there be 2.124.821.694 views, when im the only person alive after  the zombie apocalypse - greetings, spoderman :)﻿","PSY - GANGNAM STYLE(?????) M/V",0
1123,"Luna Gamer Potter",2014-11-09 02:42:40,"I hate this song! ﻿","PSY - GANGNAM STYLE(?????) M/V",0
1124,"Marieke Sp33lma",2014-09-16 12:53:43,"Watch my videos xx﻿","Katy Perry - Roar",1
1125,"Johnny Rei Vlog",2013-07-19 11:41:54.923,"Nice to meet You - this is Johnny: 1. If You already know my music - thumb this up, because You found it this way, too. 2. If You want to hear original songs completely made by 1 person, continue reading:  I sing, write original music+lyrics &amp; play guitar, bass, drums &amp; keyboards. I&#39;m a 1-man-band. My music is completely independent &amp; 100% listener-supported. If You want to hear it &amp; if You&#39;re willing to help record new album - click on my name/picture.  Enjoy the music - wish You awesome day!","Shakira - Waka Waka",1
1126,"Stuart Mcdonald",2014-11-13 00:38:14,"FOLLOW MY COMPANY ON TWITTER  thanks.  https://twitter.com/TheWaxedHatCo﻿","PSY - GANGNAM STYLE(?????) M/V",1
1127,"x Judda",2014-11-08 07:19:29,"We get it, you came here for the views... ﻿","PSY - GANGNAM STYLE(?????) M/V",0
1128,"Kathy Akers",2014-11-08 02:16:29,"I love this song so much!:-D I've heard it so much I pretty much memorized  the lyrics﻿","Katy Perry - Roar",0
1129,"Alenaid Zeledon",2014-09-18 19:21:53.622,"Check out this video on YouTube:﻿","LMFAO - Party Rock Anthem ft. Lauren Bennett, GoonRock",1
1130,"Mia Aspinall",2014-11-08 10:30:35,"2 billion views, only 2 million shares﻿","PSY - GANGNAM STYLE(?????) M/V",0
1131,"Maryf",2015-05-28 19:27:42.212,"Rihanna is absolutely gorgeous in this video.﻿","Eminem - Love The Way You Lie ft. Rihanna",0
1132,"Jose Renteria",2013-11-29 00:22:01,"We are an EDM apparel company dedicated to bringing you music inspired  designs. Our clothing is perfect for any rave or music festival. We have  NEON crop tops, tank tops, t-shirts, v-necks and accessories! follow us on  Facebook or on instagraml for free giveaways news and more!! visit our site  at OnCueApparel﻿","PSY - GANGNAM STYLE(?????) M/V",1
1133,"jay cruz",2014-09-14 13:52:43,"looooooooooooooooooooovvvvvvvvveeeeeeeeeeee ittttttttttttt﻿","Katy Perry - Roar",0
1134,"42o2 Studios",2013-10-01 19:10:56.808,"Check out my covers please!","Shakira - Waka Waka",1
1135,"vinh nguyen",2015-05-16 23:25:15.189,"Check out this video on YouTube:﻿","LMFAO - Party Rock Anthem ft. Lauren Bennett, GoonRock",1
1136,"GGSCommunity",2014-09-07 22:36:24,"Like Gorlin-Goltz Syndrome Support Community, you are not alone. https://www.facebook.com/GorlinGoltzSupport﻿","Katy Perry - Roar",1
1137,"James Cook",2013-10-14 10:35:03.861,"Hello Guys...I Found a Way to Make Money Online You Can Get Paid To Mess Around On Facebook And Twitter! GET PAID UPTO $25 to $35 AN HOUR...Only at 4NetJobs.com Work from the Comfort of your Home... They are Currently Hiring People from all Over the World, For a Wide Range of Social Media Jobs on Sites such as Facebook,Twitter and YouTube You don&#39;t Need any Prior Skills or Experience and You can Begin Work Immediately! You Can Easily Make $4000 to $5000+ Monthly Income…Only at 4NetJobs.com","Shakira - Waka Waka",1
1138,"ultimatecleanmusic",NA,"Subscribe to me for clean Eminem!","Eminem - Love The Way You Lie ft. Rihanna",1
1139,"Anthony1SV",2014-11-14 00:01:37,"Please do buy these new Christmas shirts! You can buy at any time before  December 4th and they are sold worldwide! Don't miss out:  http://teespring.com/treechristmas﻿","PSY - GANGNAM STYLE(?????) M/V",1
1140,"Ricky Smith",2014-09-07 02:43:55,"This song makes me want to drink bleach﻿","Katy Perry - Roar",0
1141,"Mjt12",NA,"Help me get 50 subs please ﻿","Eminem - Love The Way You Lie ft. Rihanna",1
1142,"randman21",2014-10-24 17:11:17,"I just realized that this verses in this song have the exact same melody as  the verses in ""Hey Ho"" by the Lumineers.﻿","Katy Perry - Roar",0
1143,"Kikilaronk “Kiki” Loz",2014-08-31 16:39:30.472,"Subscribe to me if u think &quot;swag&quot; is fucking stupid﻿","LMFAO - Party Rock Anthem ft. Lauren Bennett, GoonRock",1
1144,"Santeri Saariokari",2014-09-03 16:32:59,"Hey guys go to check my video name ""growtopia my story""﻿","Katy Perry - Roar",1
1145,"TheSkullcrusher73",2015-05-28 00:13:57.59,"who the fuck cheats on megan fox﻿","Eminem - Love The Way You Lie ft. Rihanna",0
1146,"ann anne",2015-01-28 16:29:16.993,"Check out this video on YouTube:﻿","LMFAO - Party Rock Anthem ft. Lauren Bennett, GoonRock",1
1147,"Gaven Purdin",2015-05-25 16:30:30.753,"love lmfao party rockin keep it going﻿","LMFAO - Party Rock Anthem ft. Lauren Bennett, GoonRock",0
1148,"Franklin Music",2015-05-24 02:53:52.667,"Very Nice !﻿","LMFAO - Party Rock Anthem ft. Lauren Bennett, GoonRock",0
1149,"fad lad",2014-11-06 18:24:19,"http://www.amazon.co.uk/gp/offer-listing/B00ECVF93G/sr=8-2/qid=1415297812/ref=olp_tab_refurbished?ie=UTF8&amp;condition=refurbished&amp;qid=1415297812&amp;sr=8-2 ﻿","PSY - GANGNAM STYLE(?????) M/V",1
1150,"Tom Hosford",2014-11-13 17:42:06,"To everyone joking about how he hacked to get 2 billion views because  there's a certain amount of people or whatever,  He actually did buy views.﻿","PSY - GANGNAM STYLE(?????) M/V",0
1151,"Jennifer Isaksen",2014-11-12 15:12:47,"Hahah, juyk! I allways laugh at the part 1:57.. LOL!﻿","PSY - GANGNAM STYLE(?????) M/V",0
1152,"edge mango",2015-05-19 12:40:24.071,"OH SHIT THIS WAS UPLOADED ON MY BIRTHDAY, finally my birthday isnt a curse, because on this day maylaysia airlines went missing, so i thought my birthday was a curse xD﻿","LMFAO - Party Rock Anthem ft. Lauren Bennett, GoonRock",0
1153,"SHANE MINECRAFT",2015-05-09 01:25:16.018,"Come subscribe﻿","LMFAO - Party Rock Anthem ft. Lauren Bennett, GoonRock",1
1154,"haribo elf",2014-10-21 21:09:29,"She is fit﻿","Katy Perry - Roar",0
1155,"Lindsay Wofford",2014-11-07 13:12:45,"What is he saying?!?!?!?!?!?!?!?$? ﻿","PSY - GANGNAM STYLE(?????) M/V",0
1156,"LEONARDO CAETANO",2014-01-27 19:36:00,"2 Billions in 2014","PSY - GANGNAM STYLE(?????) M/V",0
1157,"Cristian Sepulveda",2015-05-28 01:47:29.843,"Rihana, Love Me. :(﻿","Eminem - Love The Way You Lie ft. Rihanna",0
