"COMMENT_ID","AUTHOR","DATE","CONTENT","VIDEO_NAME","CLASS"
588,"Ognjen Videos",2015-04-08 21:11:31.085,"Please subscribe to my channel!Thanks!﻿","LMFAO - Party Rock Anthem ft. Lauren Bennett, GoonRock",1
589,"Arthur Teixeira",2014-11-12 20:12:47,"I wanted to know the name of the guy that dances at 00:58, anybody knows ?﻿","PSY - GANGNAM STYLE(?????) M/V",0
590,"bruno jovao",2014-11-08 04:51:38,"LoL﻿","PSY - GANGNAM STYLE(?????) M/V",0
591,"Claudia Guerra",2015-04-15 15:37:01.799,"Check out this playlist on YouTube:<br /><br />﻿","LMFAO - Party Rock Anthem ft. Lauren Bennett, GoonRock",1
592,"Technibility",2014-09-12 21:08:47,"Great video by a great artist in Katy Perry! Admire her creativity! Check  out our channel for no nonsense mobile tech reviews and comparisons as well  as an iPhone 6 and 6 Plus review and comparison!﻿","Katy Perry - Roar",1
593,"THE AMAZING MOVIE MAKING NAD GAMING TOM BURKE",2015-04-11 20:32:48.515,"Lol check out my chanell and subscribe please i want 5000 subs thats it im nearly their now﻿","LMFAO - Party Rock Anthem ft. Lauren Bennett, GoonRock",1
594,"VidéoRiveaux",2015-03-28 14:03:55.093,"Hey ! Subscribe  to me for the peace in the world ! ♥﻿","LMFAO - Party Rock Anthem ft. Lauren Bennett, GoonRock",1
595,"Patrik Gybka",2015-05-05 09:32:04.687,"SUBSCRIBE MY CHANNEL PLEASE LOL PRO PLAYS)﻿","LMFAO - Party Rock Anthem ft. Lauren Bennett, GoonRock",1
596,"Warrdrew",2014-11-07 07:46:57,"I'm here to check the views.. holy shit﻿","PSY - GANGNAM STYLE(?????) M/V",0
597,"Lil Misme",2014-08-09 03:01:25,"Hey Guys this is Glamour Beauty! I just started my youtube channel please  go check it out! I'm going to post singing videos and also random videos  that I fell like! Please go to subscribe! More to come soon!. Remember to  subscribe!﻿","Katy Perry - Roar",1
598,"MrTuizentfloot",2014-01-21 13:39:13,"This is the only video on youtube that get so much views just because we  want to see how much views it has. 1.000.000 every day, I mean, Most people  think a video is popular when it actually gets 1.000.000 views.﻿","PSY - GANGNAM STYLE(?????) M/V",0
599,"dinda zivic",2014-11-07 09:19:50,"Katy Perry - Roar (Official): http://youtu.be/CevxZvSJLk8﻿","Katy Perry - Roar",0
600,"Nicolás Jara",2014-09-10 01:50:55,"Click For iTunes code http://shhort.com/a?r=0LaviqU2b﻿","Katy Perry - Roar",1
601,"Kyle Joyce",NA,"Check out this video on YouTube:﻿","Eminem - Love The Way You Lie ft. Rihanna",1
602,"SIR JOHN",2015-05-07 02:28:12.704,"EMINEM the best EVER.﻿","Eminem - Love The Way You Lie ft. Rihanna",0
603,"BAT MAN",2015-05-19 10:33:12.247,"Really good song .<br />you know love song song.﻿","Eminem - Love The Way You Lie ft. Rihanna",0
604,"adey lanre",2015-05-25 16:39:15.791,"One of the best song of all the time﻿","Shakira - Waka Waka",0
605,"We are proud to be Smilers",2014-11-09 12:31:35,"great song, but we all know that Katy buys her views..﻿","Katy Perry - Roar",0
606,"Rayana Santos",2014-09-30 23:41:57,"Katy perry songs aren't that bad ﻿","Katy Perry - Roar",0
607,"jacobvine2000 .",NA,"Usually guys I would vote people like this down but actually check out his channel, it reminds me of a smaller version of 8 mile. Give this guy a chance since everyone has to start somewhere!","Eminem - Love The Way You Lie ft. Rihanna",1
608,"MntDewWigger",2014-11-09 12:50:06,"check out mah girl it duh shit yo﻿","Katy Perry - Roar",1
609,"Angel",2014-11-02 17:27:09,"Hi there~I'm group leader of Angel, a rookie Korean pop group. We have four  members, Chanicka, Julie, Stephanie, and myself, Leah. Please feel free to  check out our channel and leave some feedback on our cover videos (:  criticism is welcome as we know we're not top notch singers so please come  leave some constructive feedback on our videos; we appreciate any chance to  improve before auditioning for a Korean management company. We plan on  auditioning for JYP, BigHit, Jellyfish, YG or SM. Thank you for taking time  out of your day to read this !﻿","PSY - GANGNAM STYLE(?????) M/V",1
610,"meg fluttershy",2013-07-25 20:47:41.071,"Love itt and ppl check out my channel!!!","Shakira - Waka Waka",1
611,"SmexyFriedChicken",NA,"Check out my videos guy! :) Hope you guys had a good laugh :D","Eminem - Love The Way You Lie ft. Rihanna",1
612,"Ben Smith",2014-12-10 16:53:09.604,"Check out this video on YouTube:﻿","LMFAO - Party Rock Anthem ft. Lauren Bennett, GoonRock",1
613,"Decio Alves Martins",2015-06-05 19:29:20,"KATY PERRY, I AM THE ""DÉCIO CABELO"", ""DECIO HAIR"". I AM 60 YEARS OF AGE. I  DON""T HAVE FAMILY. I""M SINGLE. ALONE. HOMELESS. I WAS AN ALCOHOLIC: 15 AT  THE AGE OF 46. I AM AN INVISIBLE COMPOSER. MY DREAM IS TO RECORD MY SONGS.  COULD YOU HELP ME? PLEASE! PLEASE! I TRUST THAT THE YOU WILL GIVE ME A  CHANCE. I HAVE 109 VIDEOS IN THE YOUTUBE: deciocabelo canal. KATY PERRY, I  WAS BORN IN OCTOBER 25, TOO. THANK YOU VERY MUCH!!! DECIO HAIR.﻿","Katy Perry - Roar",1
614,"This Is Really Not Lois Arceo",2014-11-10 13:25:27,"NEW GOAL!   3,000,000!  Let's go for it!﻿","PSY - GANGNAM STYLE(?????) M/V",0
615,"YOU ARE NOW WASTING SECONDS OF YOUR LIFE BY READING THIS LONG STUPID NAME WHICH MAKES NO SENSE!",2014-11-07 22:41:04,"this comment is wrong﻿","PSY - GANGNAM STYLE(?????) M/V",0
616,"Chris Faith",NA,"I personally have never been in a abusive relationship. I probably never will. I don&#39;t hit women. Mom has my dad used to hit my mom before he left. I can relate I&#39;m writing about one at the moment subscribe to hear it. EVERY fan counts.﻿","Eminem - Love The Way You Lie ft. Rihanna",1
617,"Kelsey bolley",2014-11-08 07:25:39,"Wow this video is the most viewed youtube video.. second that comes Justin  bieber- baby SMH WHAT HAS THE WORLD COME TO﻿","PSY - GANGNAM STYLE(?????) M/V",0
618,"Lisa Wellas",NA,"+447935454150 lovely girl talk to me xxx﻿","Eminem - Love The Way You Lie ft. Rihanna",1
619,"BeatBoxBaaa",2014-11-07 09:04:08,"Have you tried a new social network TSU? This new social network has a  special thing.You can share the posts as well as on fb and twitter and even  to'll get paid You can registr here:  https://www.tsu.co/WORLDWIDE_LIFE﻿","PSY - GANGNAM STYLE(?????) M/V",1
620,"Seth Ryan",2015-05-21 20:04:36.016,"Almost a billion﻿","Eminem - Love The Way You Lie ft. Rihanna",0
621,"M.E.S",NA,"hey its M.E.S here I&#39;m a young up and coming rapper and i wanna get my music heard i know spam wont get me fame. but at the moment i got no way of getting a little attention so please do me a favour and check out my channel and drop a sub if you enjoy yourself. im just getting started so i really appreciate those who take time to leave constructive criticism i already got 200 subscribers and 4000 views on my first vid ive been told i have potential","Eminem - Love The Way You Lie ft. Rihanna",1
622,"Brandon Tomlin",2014-10-17 18:34:08,"Like my page please...  https://m.facebook.com/Dreaddis?ref=m_notif¬if_t=fbpage_fan_invite&amp;actorid=1442646731  ﻿","Katy Perry - Roar",1
623,"Ashish Sachdeva",2015-05-16 02:11:43.099,"Gooooood﻿","LMFAO - Party Rock Anthem ft. Lauren Bennett, GoonRock",0
624,"AlabaGames",2015-05-22 00:31:43.922,"Subscribe my channel  I RECORDING FIFA 15 GOALS WATCH NOW :D﻿","Shakira - Waka Waka",1
625,"NeverGreen35",2014-10-28 20:04:45,"Subscribe me and i subscribe you back!!﻿","Katy Perry - Roar",1
626,"Jerry White",NA,"You guys should check out this EXTRAORDINARY website called MONEYGQ.COM .   You can make money online and start working from home today as I am!   I am making over $3,000+ per month at MONEYGQ.COM !   Visit MONEYGQ.COM and check it out!  The cook officiates the tax. The walk judges the amount. Why does the ink train the valuable increase?","Eminem - Love The Way You Lie ft. Rihanna",1
627,"GrayGRW",2015-03-11 05:26:51.968,"Like this comment if you are watching on a phone﻿","LMFAO - Party Rock Anthem ft. Lauren Bennett, GoonRock",1
628,"Alex Despotovic",2014-11-08 05:52:20.157,"Check out my youtube channel for cool beatboxing (:﻿","LMFAO - Party Rock Anthem ft. Lauren Bennett, GoonRock",1
629,"MmmHmmm",2015-05-24 20:38:33.832,"Lamest World Cup song ever! This time FOR Africa? You mean IN Africa. It wasn&#39;t a Live Aid event or something. She made it seem like a charity case for them instead of a proud moment. Where was Ricky Martin when you needed him! SMH﻿","Shakira - Waka Waka",0
630,"Manish Ray",2015-05-23 08:55:07.512,"This song is so beauty","Shakira - Waka Waka",0
631,"Matias Álvarez calderon",2015-05-16 19:10:09.761,"awesome﻿","LMFAO - Party Rock Anthem ft. Lauren Bennett, GoonRock",0
632,"Daniel Cruz",2015-05-20 04:15:49.589,"Who else saw jesses dancing sorry if I spelled it wrong  peace✌﻿","LMFAO - Party Rock Anthem ft. Lauren Bennett, GoonRock",0
633,"Steven Slater",2013-10-15 09:56:19.653,"Being paid to respond to fast paid surveys from home has enabled me to give up working and make more than 4500 bucks monthly.  To read more go to this web site bit.ly\1bSefQe","Shakira - Waka Waka",1
634,"GORHD/TV Studio",2014-11-25 16:15:50.566,"subscribers please`﻿","LMFAO - Party Rock Anthem ft. Lauren Bennett, GoonRock",1
635,"Kiarna Burke",2015-04-11 08:36:04.034,"Check out this video on YouTube:﻿","LMFAO - Party Rock Anthem ft. Lauren Bennett, GoonRock",1
636,"Ksenia Vladimirova",2014-07-22 11:06:07.798,"Looooooooove this song!!!!!!!!!:))))))﻿","LMFAO - Party Rock Anthem ft. Lauren Bennett, GoonRock",0
637,"Nina Mackie",2015-05-17 09:07:30.578,"Take a look at this video on YouTub<br />You﻿","LMFAO - Party Rock Anthem ft. Lauren Bennett, GoonRock",1
638,"Kassidy Norris",2014-12-18 22:33:26.485,"Check out this video on YouTube:lo﻿","LMFAO - Party Rock Anthem ft. Lauren Bennett, GoonRock",1
639,"janet rangel",2015-05-25 18:03:46.138,"Love this song makes me wanna dance! ﻿","LMFAO - Party Rock Anthem ft. Lauren Bennett, GoonRock",0
640,"caitlyn keffer",2014-12-06 19:45:01.381,"Check out this video on YouTube:﻿","LMFAO - Party Rock Anthem ft. Lauren Bennett, GoonRock",1
641,"Si Ham",2015-04-30 07:59:41.488,"if you want to win money at hopme click here <a href=""https://www.paidverts.com/ref/sihaam01"">https://www.paidverts.com/ref/sihaam01</a> it&#39;s work 100/100﻿","Shakira - Waka Waka",1
642,"sarah fitzgerald",2014-09-20 07:43:50,"Please subscribe every sub gets a shout out tell me what type of videos u  want and I will try make it happen﻿","Katy Perry - Roar",1
643,"Дмитрий Гаврилов",2015-05-21 16:29:03.583,"5 years soon!﻿","Shakira - Waka Waka",0
644,"Eko Budi wibowo",2015-05-25 00:33:52.34,"good music﻿","Eminem - Love The Way You Lie ft. Rihanna",0
645,"Linda Dipilato",NA,"Check out this video on YouTube:﻿","Eminem - Love The Way You Lie ft. Rihanna",1
646,"MrJtill0317",NA,"┏━━━┓┏┓╋┏┓┏━━━┓┏━━━┓┏┓╋╋┏┓  ┃┏━┓┃┃┃╋┃┃┃┏━┓┃┗┓┏┓┃┃┗┓┏┛┃  ┃┗━━┓┃┗━┛┃┃┃╋┃┃╋┃┃┃┃┗┓┗┛┏  ┗━━┓┃┃┏━┓┃┃┗━┛┃╋┃┃┃┃╋┗┓┏┛  ┃┗━┛┃┃┃╋┃┃┃┏━┓┃┏┛┗┛┃╋╋┃┃  ┗━━━┛┗┛╋┗┛┗┛╋┗┛┗━━━┛╋╋┗┛ CHECK MY VIDEOS AND SUBSCRIBE AND LIKE PLZZ","Eminem - Love The Way You Lie ft. Rihanna",1
647,"Abhishek Kumar Gendah",2014-11-06 12:56:46,"And somehow she has access to makeup in the middle of the woods...﻿","Katy Perry - Roar",0
648,"Salvador Sanchez",2015-05-24 02:28:34.605,"Why sooooo many downs?﻿","LMFAO - Party Rock Anthem ft. Lauren Bennett, GoonRock",0
649,"Latin Bosch",2013-07-12 22:33:27.916,"Shakira is the best dancer","Shakira - Waka Waka",0
650,"EDWARD  PALMA",2015-05-26 22:40:08.281,"This the best song i ever hire<br />﻿","LMFAO - Party Rock Anthem ft. Lauren Bennett, GoonRock",0
651,"Nick Hardison",2015-05-20 21:46:43.674,"this song is fu cking awesom!!!!!!!﻿","LMFAO - Party Rock Anthem ft. Lauren Bennett, GoonRock",0
652,"Kiarna Burke",2015-04-11 08:36:04.37,"Check out this video on YouTube:﻿","LMFAO - Party Rock Anthem ft. Lauren Bennett, GoonRock",1
653,"spamworld2009",NA,"Share Eminem&#39;s Artist of the Year video so he can win. We could see a performance and acceptance speech. Like this comment so everyone can see.  2014 =  Year of Eminem","Eminem - Love The Way You Lie ft. Rihanna",1
654,"KatyPerry TheQueenOfPop",2014-10-24 06:05:07,":: ATTENTION : WE NEED 10 Million Views More for FIREWORK to Reach 500M .. We have only 1 and half day left for katy's birtgday. Listen How it could be possible?? &gt;&gt;JUST Open different Tabs from Different Browser &gt;&gt;Dont Watch Full Video, Remember We dont have time on hand, Its Time Wasting. View it only for 30 sec. Plz thumbs up and share﻿","Katy Perry - Roar",1
655,"craftygirl20141",2014-11-10 19:46:03.336,"hi everyone this is cool check out sexy and i know it﻿","LMFAO - Party Rock Anthem ft. Lauren Bennett, GoonRock",1
656,"Analena López",2015-05-28 17:08:29.827,"shakira is best for worldcup﻿","Shakira - Waka Waka",0
657,"Viperas Lord",2014-11-12 09:20:12,"www.marketglory.com/strategygame/lordviperas﻿","PSY - GANGNAM STYLE(?????) M/V",1
658,"Isuzu",2014-11-07 16:38:47,"P E A C E  &amp;  L O V E  ! !﻿","PSY - GANGNAM STYLE(?????) M/V",0
659,"Carolina Sanchez Cifuentes",2015-05-21 01:06:57.289,"Love you﻿","Eminem - Love The Way You Lie ft. Rihanna",0
660,"chantel toledo",NA,"Tell us the title so i can like and subscribe your music fgw please","Eminem - Love The Way You Lie ft. Rihanna",1
661,"GB REEFAT",2015-05-27 07:44:24.226,"MEGAN FOX AND EMINEM TOGETHER IN A VIDEO  DOESNT GET BETTER THAN THAT﻿","Eminem - Love The Way You Lie ft. Rihanna",0
662,"BigBird Larry",2015-05-24 09:44:44.694,"I cried this song bringing back some hard memories﻿","Eminem - Love The Way You Lie ft. Rihanna",0
663,"Hidden Love",2013-09-24 14:29:54.072,"Hi. Check out and share our songs.","Shakira - Waka Waka",1
664,"Por Phizer",2014-10-16 20:10:15.922,"Hey Guys Jaylan Here And I Just Wanted Everybody To Know if Yall Can Subscribe Please That Would Be Great! This Is My New Gaming Channel (Have Not Uploaded Yet)But I Will Upload If I Hit About 10 Subs Thank You :D﻿","LMFAO - Party Rock Anthem ft. Lauren Bennett, GoonRock",1
665,"Tornike Noniashvili",2014-11-08 04:08:09,"subscribe my chanel﻿","PSY - GANGNAM STYLE(?????) M/V",1
666,"AD OSG",NA,"Please check out my New Song (MUSIC VIDEO) AD - Dont Play","Eminem - Love The Way You Lie ft. Rihanna",1
667,"Charly Boy Toy",2013-09-05 17:05:33.79,"the best!","Shakira - Waka Waka",0
668,"AdmiralMusclebeard",NA,"I&#39;m subscribing to you just because your comment was that great.","Eminem - Love The Way You Lie ft. Rihanna",1
669,"arribasinaloa Beltran",2013-09-05 19:25:33.583,"shakira is the best!","Shakira - Waka Waka",0
670,"Shaun Mac",2014-10-26 20:10:46,"Also LuckyMusiqLive she probably could help u make it big because I think u  have talent. Just look her name up on the internet. Hit me up when u get  this message﻿","Katy Perry - Roar",1
671,"zonZi",2015-05-09 13:09:17.453,"Who&#39;s watching in 2015 Subscribe for me !﻿","LMFAO - Party Rock Anthem ft. Lauren Bennett, GoonRock",1
672,"viginas smell like fish",2013-10-02 03:16:47.796,"God she is so hot","Shakira - Waka Waka",0
673,"ricky swaggz",2013-08-07 23:40:12.225,"******* Facebook is LAME and so 2004! Check out ------------ swagFriends com Make thousands of cool new friends everyday! Join this new movement!","Shakira - Waka Waka",1
674,"Nguyen Thanh Son",2015-05-15 12:57:45.957,"Check out this video on YouTube:﻿","LMFAO - Party Rock Anthem ft. Lauren Bennett, GoonRock",1
675,"JakeFrostMiner Palanca",2014-11-07 20:12:11,"DISLIKE.. Now one knows REAL music - ex. Enimen ﻿","PSY - GANGNAM STYLE(?????) M/V",0
676,"Chelsea Andrews",2015-05-27 20:43:10.162,"Shakira - Waka Waka <br />LOVE THIS SONG!!!!!!!!!!!!!!!﻿","Shakira - Waka Waka",0
677,"orcou",2014-12-20 05:03:42.146,"Check out this video on YouTube:﻿","LMFAO - Party Rock Anthem ft. Lauren Bennett, GoonRock",1
678,"Liam Mcewan",2015-05-16 00:46:38.313,"shuffle!!!!!!!!!!!!!!!!!!!!!!!!!!!!!!!!!!!!!!!!!!!!!!!!!!!!!!!!!!!!!!!!!!!!!!!!!!!!!!!!!!!!!!!!!!!!!!!!!!!!!!!!!!!!!!!!!!!!!!!!!!!!!!!!!!!!!!!!!!!!!!!!!!!!!!!!!!!!!!!!!!!!!!!!!!!!!!!!!!!!!!!!!!!!!!!﻿","LMFAO - Party Rock Anthem ft. Lauren Bennett, GoonRock",0
679,"NstyIC Gold",2014-11-03 20:41:23,"Ching Ching ling long ding ring yaaaaaa Ganga sty FUCK YOU.﻿","PSY - GANGNAM STYLE(?????) M/V",0
680,"MOHAMED THASLEEM",2015-05-24 07:03:59.488,"super music﻿","Shakira - Waka Waka",0
681,"((A.B))",2014-10-04 01:35:02.414,"LMFAO is CRAZY DOPE!!! CHeck out my music on my channel if you have a minute, it would mean a lot. Much love!!﻿","LMFAO - Party Rock Anthem ft. Lauren Bennett, GoonRock",1
682,"The Robot Green Hypno",2014-11-07 13:37:51,"i like this song the video goes perfect with it﻿","Katy Perry - Roar",0
683,"YoungBrothersRecords",2014-11-06 23:22:32,"Please give us a chance and check out the new music video on our channel!  You won't be disappointed.﻿","PSY - GANGNAM STYLE(?????) M/V",1
684,"KOZZI RAP",NA,"CHECK OUT MY YOUTUBE VIDEOS FOR FUNNY AND COOL RAP","Eminem - Love The Way You Lie ft. Rihanna",1
685,"Brianna Reed",2015-05-25 03:02:02.615,"I LOVE YOUR SONGS﻿","LMFAO - Party Rock Anthem ft. Lauren Bennett, GoonRock",0
686,"HAGER KOTRY",2015-04-19 08:21:52.071,"ALL SCHOOL DROP OUTS I KNEW AS FRIENDS BEFORE THEY DECIDED TO DROP SCHOOL THINK THERE IS NO NEED FOR AN ID CARD OR A CERTIFICATION TO PROVE YOU ARE AN EDUCATED CLEAN IN CRIMINAL RECORD TALENTED PERSON TO WORK IN ANY ENTERTAINMENT FIELD WORLDWIDE. THEY THINK THEY COULD BE RICH ENTERTAINERS BY CONSOLIDATING WITH ACTORS / ACTRESSES AS WELL AS SINGERS FOR A SHARE OF PROFIT(S).﻿","LMFAO - Party Rock Anthem ft. Lauren Bennett, GoonRock",1
687,"The Technology Zoo",2014-09-21 14:48:53,"I love roar and Katy Perry. She is my favorite singer and sometimes I just  mute the volume and look at her!﻿","Katy Perry - Roar",0
688,"twee gekkos",2015-05-22 20:10:26.759,"I like this song ﻿","Shakira - Waka Waka",0
689,"John Wilkie",2015-05-20 19:35:54.615,"Lip synch is terrible﻿","Shakira - Waka Waka",0
690,"Tillolo79",2015-05-21 22:54:24.249,"Wow...5 years<br />﻿","Shakira - Waka Waka",0
691,"Lxflys yolo",2015-05-17 03:57:28.997,"Let get this video to one billion views﻿","LMFAO - Party Rock Anthem ft. Lauren Bennett, GoonRock",0
692,"kissmehk",2015-05-23 19:37:52.24,":)﻿","Eminem - Love The Way You Lie ft. Rihanna",0
693,"RoyEpperson",2015-05-28 00:59:58.305,"Is that Charlie from lost?<br />﻿","Eminem - Love The Way You Lie ft. Rihanna",0
694,"Ray Benich",2015-06-05 18:05:16,"The first billion viewed this because they thought it was really cool, the  other billion and a half came to see how stupid the first billion were...﻿","PSY - GANGNAM STYLE(?????) M/V",0
695,"Haley Harmicar",2014-11-08 05:35:42,"9 year olds be like, 'How does this have 2 billion views when there are  only 3 people in the world'﻿","PSY - GANGNAM STYLE(?????) M/V",0
696,"Nancy Kiragu",2015-05-12 11:48:27.242,"Check out this playlist on YouTube:Central ﻿","Shakira - Waka Waka",1
697,"yakikukamo FIRELOVER",2013-07-18 17:07:06.152,"hey you ! check out the channel of Alvar Lake !!","Shakira - Waka Waka",1
698,"bea boots",2014-09-14 12:42:56,"great song you go katy!﻿","Katy Perry - Roar",0
699,"gamila Khalil",2015-05-14 19:02:59.21,"Check out this video on YouTube:﻿","Shakira - Waka Waka",1
700,"Lizle Productions",2015-05-16 11:33:22.322,"Top three Shakira songs (my choice) <br /><br />1- Waka Waka (it&#39;s time for Africa)<br /><br />2- Can&#39;t remember to forget you <br /><br />3- Empire<br /><br />Like this comment if u like Shakira ﻿","Shakira - Waka Waka",1
701,"Damax",2015-05-29 00:41:22.426,"Almost 1 billion﻿","Eminem - Love The Way You Lie ft. Rihanna",0
702,"Rachael Knapp",NA,"Check out this video on YouTube:﻿","Eminem - Love The Way You Lie ft. Rihanna",1
703,"Juan Aimar",2015-05-21 18:52:17.472,"Anybody else here in 2015?﻿","Eminem - Love The Way You Lie ft. Rihanna",0
704,"witsnow roxiie",2014-11-07 20:45:32,"We pray for you Little Psy ♡﻿","PSY - GANGNAM STYLE(?????) M/V",0
705,"mariam shoja",2015-04-23 10:14:34.527,"Check out this video on YouTube:﻿","Shakira - Waka Waka",1
706,"Ghazwan Mattoka",2014-09-23 17:19:23,"Nice song﻿","Katy Perry - Roar",0
707,"Louis Bryant",NA,"You guys should check out this EXTRAORDINARY website called ZONEPA.COM . You can make money online and start working from home today as I am! I am making over $3,000+ per month at ZONEPA.COM ! Visit Zonepa.com and check it out! How does the burst render the symptomatic bite? The knowledge briefs the narrow thought. How does the eager sky transmit the crush?","Eminem - Love The Way You Lie ft. Rihanna",1
708,"Owen Lai",2013-12-01 04:51:52,"just checking the views﻿","PSY - GANGNAM STYLE(?????) M/V",0
709,"Portman P.",2015-06-05 10:04:47,"SIMPLY PUT, OUR CUSTOMERS LOVE US... and so will you!https://www.facebook.com/greenleader﻿","Katy Perry - Roar",1
710,"Lupitaochoa Dieciseis",2015-05-24 03:02:38.357,"Love it!!!!!!!!!!!!!!!!💜﻿","Shakira - Waka Waka",0
711,"nienke de kimpe",2015-05-25 07:14:26.531,"Cool﻿","LMFAO - Party Rock Anthem ft. Lauren Bennett, GoonRock",0
712,"Magic Johnson",2014-09-16 03:36:41,"Katy Perry is garbage. Rihanna is the best singer in the world. ﻿","Katy Perry - Roar",0
713,"TransFormersAddict11",2015-05-27 10:45:17.666,"I remember back when this was so popular everyone on our school was shuffling it was crazy﻿","LMFAO - Party Rock Anthem ft. Lauren Bennett, GoonRock",0
714,"Bryan Carter",NA,"Check out this video on YouTube:﻿","Eminem - Love The Way You Lie ft. Rihanna",1
715,"Trollsif Stalin",2015-05-21 01:05:19.225,"I believe that soccer promotes terrorism. Bad choice, Shakira.﻿","Shakira - Waka Waka",0
716,"Emily Thrun",2014-10-27 21:59:07,"Put famous people in the jungle for an hour and look what happens.﻿","Katy Perry - Roar",0
717,"Ripazha Gaming",2014-11-12 17:37:08,"http://hackfbaccountlive.com/?ref=5242575﻿","PSY - GANGNAM STYLE(?????) M/V",1
718,"OFFICIAL LEXIS",2014-11-04 20:22:21,"Hi everyone! Do you like music? Then why not check out my music channel.  The LEXIS band will be uploading their own songs and covers soon so don't  miss out. Please SUBSCRIBE too as it does help us out a lot. Just takes one  click. -&gt;﻿","PSY - GANGNAM STYLE(?????) M/V",1
719,"DJ ROY",2013-08-02 21:02:09.931,"Hey youtubers... I really appreciate all of you who took the time, to read this, I am just a 19 year old boy who wants to be a successful musician in the music world. I dont have any money to advertise my channel, If you could just visit my channel, comment on my video or subscribe, that would be great.... It will only be few seconds of your life..... Thank u to all the people who just gave me a chance l really appreciate it","Shakira - Waka Waka",1
720,"Krystian Konrad Moreński",2013-09-06 09:38:13.854,"Part 5. Comforter of the afflicted, pray for us Help of Christians, pray for us Queen of Angels, pray for us Queen of Patriarchs, pray for us Queen of Prophets, pray for us Queen of Apostles, pray for us Queen of Martyrs, pray for us Queen of Confessors, pray for us Queen of Virgins, pray for us Queen of all Saints, pray for us Queen conceived without original sin, pray for us Queen of the most holy Rosary, pray for us Queen of the family, pray for us Queen of peace, pray for us","Shakira - Waka Waka",1
721,"Angie Vazquez",2015-05-23 02:51:23.999,"I love this song &amp;I love shakira&lt;333♡♡♡♡♡♡♡♡♡♡♡《33☆☆☆﻿","Shakira - Waka Waka",0
722,"Ashleigh_ Baise",2015-05-28 22:21:26.037,"The boyfriend was Charlie from the TV show LOST ﻿","Eminem - Love The Way You Lie ft. Rihanna",0
723,"Eric Gonzalez",2015-05-28 20:47:12.193,"860,000,000 lets make it first female to reach one billion!! Share it and replay it! ﻿","Shakira - Waka Waka",0
724,"Toby Bywater",2015-05-25 01:47:45.053,"Thumbs up if your watching in 2015﻿","Shakira - Waka Waka",1
725,"Tony K Frazier",2013-11-28 23:57:13,"http://ubuntuone.com/40beUutVu2ZKxK4uTgPZ8K﻿","PSY - GANGNAM STYLE(?????) M/V",1
726,"dan19752008",2015-05-17 11:50:46.223,"What&#39;s with the guys jacket? 1 sleeve and a sleeveless arm﻿","LMFAO - Party Rock Anthem ft. Lauren Bennett, GoonRock",0
727,"EDIN TIUL",2014-10-31 20:39:28,"http://hackfbaccountlive.com/?ref=4344749﻿","Katy Perry - Roar",1
728,"Amir bassem",NA,"if u love rihanna subscribe me","Eminem - Love The Way You Lie ft. Rihanna",1
729,"Louis Bryant",NA,"You guys should check out this EXTRAORDINARY website called ZONEPA.COM . You can make money online and start working from home today as I am! I am making over $3,000+ per month at ZONEPA.COM ! Visit Zonepa.com and check it out! How does the mammoth waste achieve the shock? How does the limit reduce the delicate minute? How does the meaty scale adapt the oil?","Eminem - Love The Way You Lie ft. Rihanna",1
730,"KeithLinscotts",NA,"check out you tube keithlinscotts one word keithlinscotts you tube .com","Eminem - Love The Way You Lie ft. Rihanna",1
731,"Gintoki Sakata",2013-09-06 19:35:01.117,"Love it","Shakira - Waka Waka",0
732,"Maryam Yassine",2014-10-08 12:39:49,"OMG I LOVE YOU KATY PARRY YOUR SONGS ROCK!!!!!!!!!!!!!!!!! THATS A TOTAL  SUBSCRIBE﻿","Katy Perry - Roar",0
733,"J STROMMER",2014-08-11 17:32:00,"Take a break from Katie and help me reach 100 subscribers this month!  New  music and free downloads! ﻿","Katy Perry - Roar",1
734,"TheJohnRage",NA,"Alright ladies, if you like this song, then check out John Rage.  He&#39;s a smoking hot rapper coming into the game.  He&#39;s not better than Eminem lyrically, but he&#39;s hotter. Hear some of his songs on my channel.﻿","Eminem - Love The Way You Lie ft. Rihanna",1
